{
  "schema": "ihat://identity/user-session/v1",
  "id": "session-record/nerp-001",
  "revision": 1,
  "created_at": "2026-08-03T01:00:00.000Z",
  "updated_at": "2026-08-03T01:00:20.000Z",
  "digest": "sha256:0a2e25ee5cd9817372a08f384a962f95b0d5215ae796340638f2040c9bfce106",
  "service_account_id": "service-account/nerp-001",
  "device_id": "device/windows-001",
  "session_handle_digest": "sha256:2222222222222222222222222222222222222222222222222222222222222222",
  "broker_reference": "cred/session-reference-001",
  "issuer": "https://id.ihat.online",
  "audience": "nerp",
  "assurance": "phishing-resistant",
  "authentication_methods": ["passkey"],
  "authenticated_at": "2026-08-03T01:00:00.000Z",
  "last_seen_at": "2026-08-03T01:00:20.000Z",
  "expires_at": "2026-08-03T02:00:00.000Z",
  "revocation_epoch": 0,
  "status": "active"
}
